{"schemaVersion":1,"id":"alibi-master-grandmaster-studies","version":1,"title":"Alibi · Master and Grandmaster Studies","author":"Alibi","puzzles":[{"id":"master-study-nonogram-01","revision":1,"type":"nonogram","title":"The moth in the lantern","subtitle":"The Glasshouse Folio","difficulty":"Grandmaster","difficultyStatus":"provisional","difficultyEvidence":"A symmetric 15×15 silhouette breaks into many short runs; row deductions repeatedly unlock paired column fragments before the central body can be confirmed.","size":15,"story":"A pressed-wing diagram was hidden inside the Glasshouse folio. Reconstruct the moth from the surviving row and column runs.","solution":[1,0,1,0,0,0,0,1,0,0,0,0,1,0,1,1,1,0,1,0,0,0,1,0,0,0,1,0,1,1,0,1,0,0,0,0,1,0,1,0,0,0,0,1,0,1,1,1,1,0,0,1,1,1,0,0,1,1,1,1,1,1,0,1,0,0,0,1,0,0,0,1,0,1,1,0,0,0,1,1,0,1,1,1,0,1,1,0,0,0,1,0,0,0,1,0,0,1,0,0,1,0,0,0,1,1,1,0,0,0,0,0,1,0,0,0,0,0,1,1,0,1,1,0,1,1,0,1,0,1,1,0,1,1,0,0,1,1,1,0,1,0,1,0,1,0,1,1,1,0,1,1,1,0,0,0,1,1,1,0,0,0,1,1,1,1,0,0,0,1,0,0,1,0,0,1,0,0,0,1,0,0,0,0,1,0,0,0,0,0,1,0,0,0,0,0,0,0,1,1,0,1,1,1,0,1,1,0,0,0,0,1,0,1,1,0,0,1,0,0,1,1,0,1,0],"rowClues":[[1,1,1,1,1],[2,1,1,1,2],[1,1,1,1],[4,3,4],[2,1,1,1,2],[2,3,2],[1,1,1,1,1],[2,1,2],[2,2,1,2,2],[3,1,1,1,3],[3,3,3],[1,1,1,1,1],[1,1],[2,3,2],[1,2,1,2,1]],"colClues":[[2,2,2,2],[4,4,1],[1,1,3],[1,3,1,2],[2,1,4],[2],[2,1,1,1],[2,9,2],[2,1,1,1],[2],[2,1,4],[1,3,1,2],[1,1,3],[4,4,1],[2,2,2,2]]},{"id":"master-study-binary-01","revision":1,"type":"binary","title":"The divided annunciator","subtitle":"The West Signal Room","difficulty":"Grandmaster","difficultyStatus":"provisional","difficultyEvidence":"An 8×8 balance uses sparse marks, distinct-line constraints and paired no-triple deductions to carry the final third of the grid.","size":8,"story":"Restore the divided annunciator. Every row and column must contain four marks of each kind, no three identical marks may touch, and no two complete lines may match.","solution":[0,0,1,0,1,1,0,1,0,1,0,1,0,1,0,1,1,1,0,1,0,0,1,0,1,0,1,0,1,0,1,0,0,1,0,0,1,1,0,1,0,0,1,1,0,0,1,1,1,0,1,1,0,1,0,0,1,1,0,0,1,0,1,0],"givens":[-1,-1,-1,-1,-1,-1,0,-1,-1,1,-1,1,-1,-1,0,-1,1,1,-1,-1,-1,-1,-1,-1,-1,-1,-1,-1,1,-1,-1,-1,-1,-1,-1,-1,-1,1,-1,1,0,0,-1,-1,-1,-1,-1,-1,-1,-1,-1,-1,-1,-1,-1,-1,1,-1,0,-1,-1,-1,1,-1]},{"id":"master-study-futoshiki-01","revision":1,"type":"futoshiki","title":"The ascending register","subtitle":"The Observatory Accounts","difficulty":"Grandmaster","difficultyStatus":"provisional","difficultyEvidence":"Six sparse givens intersect a long, branching inequality network; no row resolves in isolation and several late placements depend on cross-column order bounds.","size":7,"story":"Complete the observatory register with one of each value in every row and column. Each sign records the surviving order between neighbouring entries.","solution":[1,7,6,3,4,2,5,3,6,4,5,1,7,2,7,3,5,6,2,1,4,5,4,1,2,3,6,7,4,2,7,1,6,5,3,2,1,3,7,5,4,6,6,5,2,4,7,3,1],"givens":[1,7,0,3,0,0,5,0,0,0,0,0,0,0,7,0,0,0,0,0,0,0,0,0,0,0,0,0,0,0,0,0,0,0,0,0,0,0,0,0,4,0,0,0,0,0,0,0,0],"inequalities":[{"a":16,"b":23,"op":">"},{"a":12,"b":13,"op":">"},{"a":15,"b":16,"op":"<"},{"a":47,"b":48,"op":">"},{"a":39,"b":40,"op":">"},{"a":23,"b":24,"op":"<"},{"a":35,"b":42,"op":"<"},{"a":22,"b":29,"op":">"},{"a":46,"b":47,"op":">"},{"a":24,"b":31,"op":">"},{"a":21,"b":22,"op":">"},{"a":3,"b":10,"op":"<"},{"a":10,"b":17,"op":"<"},{"a":10,"b":11,"op":">"},{"a":26,"b":33,"op":">"},{"a":33,"b":34,"op":">"},{"a":38,"b":39,"op":">"},{"a":36,"b":43,"op":"<"},{"a":36,"b":37,"op":"<"},{"a":27,"b":34,"op":">"},{"a":15,"b":22,"op":"<"},{"a":9,"b":10,"op":"<"},{"a":21,"b":28,"op":">"},{"a":29,"b":36,"op":">"}]},{"id":"master-study-lightup-01","revision":1,"type":"lightup","title":"The lantern vault","subtitle":"The Lower Arcade","difficulty":"Master","difficultyStatus":"provisional","difficultyEvidence":"A 7×7 vault leaves only a handful of numbered walls; overlapping visibility corridors and exact wall counts force a chain of lamps across all four quadrants.","size":7,"story":"Place lanterns through the lower arcade so every open tile is lit, no two lanterns see one another, and each numbered wall receives exactly its stated neighbours.","walls":[-2,-2,-2,-1,-1,-1,1,-2,-2,-2,-2,1,-2,-2,1,-2,-2,-2,-2,-2,-2,1,-2,-2,-2,-2,-2,-2,-2,-2,1,-2,1,-2,-2,2,0,-2,-2,-2,-2,-2,-2,-2,-2,-2,-1,-2,0],"solution":[0,1,0,0,0,0,0,1,0,0,0,0,0,1,0,0,0,0,1,0,0,0,0,1,0,0,0,0,1,0,0,0,0,1,0,0,0,0,1,0,0,0,1,0,0,0,0,0,0]},{"id":"master-study-tents-01","revision":1,"type":"tents","title":"The orchard encampment","subtitle":"The North Garden","difficulty":"Master","difficultyStatus":"provisional","difficultyEvidence":"Ten tree–tent pairings cross a 7×7 orchard; line totals, diagonal exclusions and a late matching bottleneck prevent local greedy placement.","size":7,"story":"Place one tent beside each tree in the north garden. Tents may not touch, even diagonally, and the row and column totals must all match.","trees":[14,35,1,43,41,26,47,10,31,5],"solution":[0,0,1,0,0,0,1,0,0,0,0,1,0,0,0,1,0,0,0,0,0,0,0,0,1,0,0,0,0,0,0,0,0,1,0,0,0,0,0,0,0,0,1,0,1,0,1,0,1],"rowTargets":[2,1,1,1,1,0,4],"colTargets":[1,1,2,1,2,1,2]},{"id":"master-study-aquarium-01","revision":1,"type":"aquarium","title":"The nine flood chambers","subtitle":"The River Archive","difficulty":"Master","difficultyStatus":"provisional","difficultyEvidence":"Nine irregular reservoirs share seven row and seven column totals; several tanks span four heights, so waterlines must be compared globally rather than solved tank by tank.","size":7,"story":"Set the waterline in each flood chamber. Water fills every square at a tank’s chosen height and below, while all row and column totals must match.","tanks":[0,0,4,4,7,7,7,0,4,4,4,7,7,7,4,4,4,7,7,7,1,4,4,5,7,3,7,1,8,5,5,7,3,3,2,8,8,5,3,3,2,2,8,8,5,3,6,6,6],"solution":[1,0,1,4,0,4,0,5,3],"rowTargets":[3,4,3,4,6,7,4],"colTargets":[4,3,4,5,6,6,3]},{"id":"master-study-network-01","revision":1,"type":"network","title":"The forty-nine relays","subtitle":"The City Switchboard","difficulty":"Master","difficultyStatus":"provisional","difficultyEvidence":"A lock-free 7×7 spanning network uses every tile; edge propagation begins the solve, but repeated tees and bends require connectivity reasoning through the central switchboard.","size":7,"story":"Rotate every relay until all forty-nine tiles form one closed signal network with no line pointing off the board or into a blank edge.","source":24,"locked":[],"tiles":[12,6,3,3,3,9,1,10,6,12,10,5,3,14,10,2,6,12,13,6,10,12,11,3,2,8,5,5,1,9,10,10,9,5,4,10,6,5,10,6,9,9,3,13,10,5,10,5,12],"solution":[3,1,1,2,1,3,2,1,3,1,1,0,0,1,1,1,0,1,2,1,1,2,3,0,2,1,0,0,2,1,0,0,3,0,2,1,0,1,0,2,1,3,0,1,0,1,0,1,1]},{"id":"master-study-trail-01","revision":1,"type":"trail","title":"The thirty-sixth step","subtitle":"The Upper Stacks","difficulty":"Grandmaster","difficultyStatus":"provisional","difficultyEvidence":"Only a small set of anchors remains on a 6×6 Hamilton path; parity, Manhattan distance and forced-neighbour chains carry long stretches before the final route closes.","size":6,"story":"Trace one continuous numbered route through all thirty-six stack tiles. Consecutive values share an edge and every tile is used exactly once.","solution":[3,2,9,10,11,12,4,1,8,23,22,13,5,6,7,24,21,14,32,31,30,25,20,15,33,34,29,26,19,16,36,35,28,27,18,17],"givens":[0,0,0,0,0,0,0,1,8,0,0,0,0,0,0,0,0,0,0,0,0,0,0,0,0,0,0,0,0,0,36,35,28,0,18,0]},{"id":"master-study-bridges-01","revision":1,"type":"bridges","title":"The drowned colonnade","subtitle":"The Tidal Court","difficulty":"Grandmaster","difficultyStatus":"provisional","difficultyEvidence":"A fifteen-island sightline graph contains cycles and mutually crossing route options; degree totals leave alternatives until connectivity and crossing exclusions force the final doubles.","size":9,"story":"Restore the drowned colonnade. Connect all islands into one network, meet every island count, use no more than two bridges per route and never let bridges cross.","islands":[{"cell":1,"count":2},{"cell":5,"count":4},{"cell":7,"count":2},{"cell":9,"count":1},{"cell":14,"count":4},{"cell":15,"count":3},{"cell":45,"count":3},{"cell":47,"count":3},{"cell":51,"count":4},{"cell":54,"count":4},{"cell":55,"count":6},{"cell":56,"count":3},{"cell":59,"count":1},{"cell":73,"count":2},{"cell":78,"count":2}],"solution":[0,2,2,2,0,1,2,0,1,0,2,2,1,1,2,1,1,1,1]}]}
