{
  "schemaVersion": 1,
  "id": "alibi-binary-large",
  "version": 1,
  "title": "Sun & moon · A longer balance",
  "author": "Alibi",
  "puzzles": [
    {
      "id": "binary-large-01",
      "revision": 1,
      "type": "binary",
      "title": "Long watch",
      "subtitle": "A longer balance · difficulty provisional",
      "difficulty": "Steady",
      "size": 8,
      "givens": [
        -1,
        -1,
        -1,
        -1,
        -1,
        -1,
        -1,
        -1,
        -1,
        0,
        -1,
        -1,
        -1,
        0,
        -1,
        -1,
        -1,
        -1,
        -1,
        -1,
        0,
        0,
        -1,
        0,
        -1,
        1,
        1,
        -1,
        -1,
        -1,
        -1,
        -1,
        0,
        -1,
        0,
        1,
        -1,
        -1,
        -1,
        -1,
        -1,
        -1,
        -1,
        1,
        -1,
        -1,
        -1,
        -1,
        1,
        1,
        -1,
        -1,
        -1,
        -1,
        -1,
        -1,
        -1,
        0,
        -1,
        -1,
        -1,
        0,
        -1,
        -1
      ],
      "solution": [
        0,
        1,
        0,
        0,
        1,
        1,
        0,
        1,
        1,
        0,
        0,
        1,
        0,
        0,
        1,
        1,
        1,
        0,
        1,
        1,
        0,
        0,
        1,
        0,
        0,
        1,
        1,
        0,
        1,
        1,
        0,
        0,
        0,
        1,
        0,
        1,
        0,
        0,
        1,
        1,
        1,
        0,
        1,
        1,
        0,
        1,
        0,
        0,
        1,
        1,
        0,
        0,
        1,
        1,
        0,
        0,
        0,
        0,
        1,
        0,
        1,
        0,
        1,
        1
      ]
    },
    {
      "id": "binary-large-02",
      "revision": 1,
      "type": "binary",
      "title": "Tide after dusk",
      "subtitle": "A longer balance · difficulty provisional",
      "difficulty": "Tricky",
      "size": 8,
      "givens": [
        -1,
        -1,
        -1,
        -1,
        -1,
        -1,
        1,
        -1,
        -1,
        -1,
        0,
        -1,
        -1,
        -1,
        -1,
        0,
        -1,
        0,
        -1,
        1,
        -1,
        -1,
        -1,
        -1,
        0,
        0,
        -1,
        1,
        -1,
        -1,
        -1,
        -1,
        -1,
        -1,
        -1,
        0,
        0,
        -1,
        -1,
        -1,
        -1,
        -1,
        -1,
        -1,
        -1,
        -1,
        -1,
        -1,
        -1,
        1,
        -1,
        -1,
        -1,
        0,
        -1,
        -1,
        -1,
        -1,
        -1,
        -1,
        -1,
        -1,
        -1,
        -1
      ],
      "solution": [
        0,
        1,
        1,
        0,
        0,
        1,
        1,
        0,
        1,
        1,
        0,
        0,
        1,
        0,
        1,
        0,
        1,
        0,
        0,
        1,
        1,
        0,
        0,
        1,
        0,
        0,
        1,
        1,
        0,
        1,
        1,
        0,
        0,
        1,
        1,
        0,
        0,
        1,
        0,
        1,
        1,
        0,
        0,
        1,
        1,
        0,
        1,
        0,
        0,
        1,
        1,
        0,
        1,
        0,
        0,
        1,
        1,
        0,
        0,
        1,
        0,
        1,
        0,
        1
      ]
    },
    {
      "id": "binary-large-03",
      "revision": 1,
      "type": "binary",
      "title": "Lantern ledger",
      "subtitle": "A longer balance · difficulty provisional",
      "difficulty": "Tricky",
      "size": 8,
      "givens": [
        -1,
        -1,
        1,
        -1,
        -1,
        -1,
        0,
        -1,
        1,
        -1,
        -1,
        -1,
        1,
        -1,
        0,
        -1,
        -1,
        -1,
        -1,
        -1,
        -1,
        0,
        -1,
        -1,
        -1,
        0,
        -1,
        -1,
        1,
        -1,
        -1,
        0,
        -1,
        -1,
        -1,
        0,
        -1,
        -1,
        1,
        -1,
        -1,
        -1,
        -1,
        -1,
        -1,
        -1,
        -1,
        0,
        0,
        -1,
        0,
        0,
        -1,
        -1,
        0,
        -1,
        1,
        0,
        -1,
        -1,
        -1,
        -1,
        -1,
        -1
      ],
      "solution": [
        0,
        0,
        1,
        1,
        0,
        1,
        0,
        1,
        1,
        1,
        0,
        0,
        1,
        1,
        0,
        0,
        0,
        1,
        0,
        1,
        0,
        0,
        1,
        1,
        1,
        0,
        1,
        0,
        1,
        1,
        0,
        0,
        0,
        0,
        1,
        0,
        1,
        0,
        1,
        1,
        1,
        1,
        0,
        1,
        0,
        0,
        1,
        0,
        0,
        1,
        0,
        0,
        1,
        1,
        0,
        1,
        1,
        0,
        1,
        1,
        0,
        0,
        1,
        0
      ]
    },
    {
      "id": "binary-large-04",
      "revision": 1,
      "type": "binary",
      "title": "Eclipse at the quay",
      "subtitle": "A longer balance · difficulty provisional",
      "difficulty": "Tricky",
      "size": 8,
      "givens": [
        1,
        -1,
        -1,
        0,
        0,
        -1,
        -1,
        -1,
        -1,
        -1,
        -1,
        -1,
        1,
        1,
        -1,
        -1,
        0,
        1,
        -1,
        -1,
        0,
        -1,
        -1,
        -1,
        -1,
        -1,
        0,
        -1,
        0,
        -1,
        -1,
        -1,
        -1,
        0,
        -1,
        -1,
        -1,
        -1,
        0,
        -1,
        -1,
        -1,
        -1,
        -1,
        0,
        0,
        1,
        1,
        -1,
        -1,
        1,
        -1,
        -1,
        -1,
        -1,
        -1,
        -1,
        -1,
        -1,
        -1,
        -1,
        -1,
        -1,
        -1
      ],
      "solution": [
        1,
        0,
        1,
        0,
        0,
        1,
        1,
        0,
        1,
        0,
        1,
        0,
        1,
        1,
        0,
        0,
        0,
        1,
        0,
        1,
        0,
        0,
        1,
        1,
        0,
        1,
        0,
        1,
        0,
        1,
        1,
        0,
        1,
        0,
        1,
        0,
        1,
        0,
        0,
        1,
        1,
        0,
        0,
        1,
        0,
        0,
        1,
        1,
        0,
        1,
        1,
        0,
        1,
        1,
        0,
        0,
        0,
        1,
        0,
        1,
        1,
        0,
        0,
        1
      ]
    }
  ]
}
