{
  "schemaVersion": 1,
  "id": "alibi-sudoku-expert",
  "version": 1,
  "title": "Sudoku · Expert studies",
  "author": "Alibi",
  "puzzles": [
    {
      "id": "sudoku-expert-01",
      "revision": 1,
      "type": "sudoku",
      "title": "The Locked Cabinet",
      "subtitle": "A sparse 9 × 9 study in disciplined candidates",
      "difficulty": "Expert",
      "difficultyStatus": "provisional",
      "size": 9,
      "boxRows": 3,
      "boxCols": 3,
      "solution": [
        3,
        5,
        6,
        4,
        2,
        9,
        7,
        1,
        8,
        4,
        9,
        1,
        7,
        3,
        8,
        5,
        6,
        2,
        2,
        8,
        7,
        1,
        6,
        5,
        4,
        9,
        3,
        7,
        3,
        9,
        2,
        8,
        6,
        1,
        5,
        4,
        8,
        1,
        5,
        9,
        4,
        7,
        2,
        3,
        6,
        6,
        2,
        4,
        5,
        1,
        3,
        8,
        7,
        9,
        1,
        7,
        8,
        3,
        9,
        2,
        6,
        4,
        5,
        9,
        4,
        2,
        6,
        5,
        1,
        3,
        8,
        7,
        5,
        6,
        3,
        8,
        7,
        4,
        9,
        2,
        1
      ],
      "givens": [
        0,
        0,
        6,
        0,
        0,
        9,
        0,
        0,
        0,
        0,
        9,
        0,
        7,
        0,
        0,
        0,
        0,
        0,
        2,
        0,
        0,
        0,
        6,
        0,
        0,
        0,
        0,
        7,
        0,
        0,
        0,
        8,
        0,
        0,
        5,
        0,
        0,
        1,
        0,
        0,
        0,
        0,
        2,
        0,
        0,
        0,
        0,
        4,
        0,
        0,
        3,
        0,
        0,
        9,
        0,
        7,
        0,
        3,
        0,
        0,
        6,
        0,
        0,
        9,
        0,
        0,
        0,
        5,
        0,
        0,
        8,
        0,
        0,
        0,
        3,
        0,
        0,
        4,
        0,
        0,
        1
      ]
    },
    {
      "id": "sudoku-expert-02",
      "revision": 1,
      "type": "sudoku",
      "title": "Three Corners in Fog",
      "subtitle": "A sparse 9 × 9 study in hidden singles",
      "difficulty": "Expert",
      "difficultyStatus": "provisional",
      "size": 9,
      "boxRows": 3,
      "boxCols": 3,
      "solution": [
        2,
        5,
        3,
        7,
        8,
        6,
        4,
        1,
        9,
        8,
        1,
        6,
        3,
        9,
        4,
        2,
        5,
        7,
        9,
        4,
        7,
        5,
        2,
        1,
        6,
        8,
        3,
        6,
        7,
        8,
        2,
        1,
        5,
        3,
        9,
        4,
        5,
        3,
        2,
        4,
        6,
        9,
        8,
        7,
        1,
        4,
        9,
        1,
        8,
        7,
        3,
        5,
        6,
        2,
        3,
        8,
        4,
        9,
        5,
        7,
        1,
        2,
        6,
        1,
        2,
        9,
        6,
        4,
        8,
        7,
        3,
        5,
        7,
        6,
        5,
        1,
        3,
        2,
        9,
        4,
        8
      ],
      "givens": [
        0,
        5,
        0,
        0,
        8,
        0,
        0,
        0,
        0,
        8,
        0,
        0,
        0,
        0,
        4,
        0,
        0,
        0,
        0,
        0,
        7,
        5,
        0,
        0,
        0,
        0,
        0,
        0,
        0,
        8,
        2,
        0,
        0,
        0,
        9,
        0,
        0,
        3,
        0,
        0,
        6,
        0,
        0,
        0,
        1,
        4,
        0,
        0,
        0,
        0,
        3,
        5,
        0,
        0,
        0,
        0,
        4,
        9,
        0,
        0,
        0,
        2,
        0,
        1,
        0,
        0,
        0,
        0,
        0,
        7,
        0,
        0,
        0,
        6,
        0,
        0,
        3,
        0,
        0,
        0,
        8
      ]
    },
    {
      "id": "sudoku-expert-03",
      "revision": 1,
      "type": "sudoku",
      "title": "The Last Lantern",
      "subtitle": "A sparse 9 × 9 study in patient elimination",
      "difficulty": "Expert",
      "difficultyStatus": "provisional",
      "size": 9,
      "boxRows": 3,
      "boxCols": 3,
      "solution": [
        2,
        3,
        1,
        4,
        5,
        8,
        7,
        6,
        9,
        8,
        9,
        6,
        7,
        2,
        1,
        3,
        4,
        5,
        4,
        7,
        5,
        3,
        9,
        6,
        1,
        8,
        2,
        3,
        4,
        7,
        1,
        6,
        2,
        9,
        5,
        8,
        5,
        1,
        8,
        9,
        4,
        7,
        6,
        2,
        3,
        6,
        2,
        9,
        8,
        3,
        5,
        4,
        1,
        7,
        7,
        8,
        2,
        6,
        1,
        9,
        5,
        3,
        4,
        1,
        5,
        4,
        2,
        7,
        3,
        8,
        9,
        6,
        9,
        6,
        3,
        5,
        8,
        4,
        2,
        7,
        1
      ],
      "givens": [
        0,
        0,
        0,
        4,
        0,
        0,
        7,
        0,
        0,
        0,
        0,
        0,
        0,
        2,
        0,
        0,
        4,
        0,
        0,
        0,
        0,
        0,
        0,
        6,
        0,
        0,
        2,
        0,
        0,
        7,
        0,
        0,
        0,
        0,
        0,
        8,
        5,
        0,
        0,
        9,
        0,
        0,
        6,
        0,
        0,
        0,
        2,
        0,
        0,
        3,
        0,
        0,
        1,
        0,
        0,
        8,
        0,
        0,
        1,
        0,
        0,
        3,
        0,
        0,
        0,
        4,
        0,
        0,
        3,
        0,
        0,
        6,
        9,
        0,
        0,
        5,
        0,
        0,
        2,
        0,
        0
      ]
    }
  ]
}
